{
  "$schema": "https://json-schema.org/draft/2020-12/schema",
  "format": "scoring-golden-corpus",
  "schemaVersion": "1.1.0",
  "corpusId": "scoring-golden-corpus",
  "scenarioSchema": "golden-scenario.schema.json",
  "ordering": "scenarioId-ascending",
  "scenarios": [
    { "scenarioId": "epee.audio-visual-correlation", "path": "golden-scenarios/epee-audio-visual-correlation.json", "weapon": "epee", "status": "active", "sourceIds": ["EPEE-05", "EPEE-TEST-AUDIO-VISUAL"], "contentDigest": "sha256:d9ef70338b36662e5d3e1e38d431d53d5f8f6a9700a099f9b2bd71683858cc98" },
    { "scenarioId": "epee.contact-boundaries", "path": "golden-scenarios/epee-contact-boundaries.json", "weapon": "epee", "status": "active", "sourceIds": ["EPEE-03", "EPEE-TEST-CONTACT-MINIMUM"], "contentDigest": "sha256:0f72d433fb0fd14a847ac3c8c04adc5008f928f002f498f9c358b2a5cef0c7fb" },
    { "scenarioId": "epee.double-lockout-boundary", "path": "golden-scenarios/epee-double-lockout-boundary.json", "weapon": "epee", "status": "active", "sourceIds": ["EPEE-02", "EPEE-TEST-LOCKOUT-BOUNDARY"], "contentDigest": "sha256:76977a52720e49ba098e29e83ba06e99703490ccb4989f55578bddbf217cf6a0" },
    { "scenarioId": "epee.exceptional-resistance-duration", "path": "golden-scenarios/epee-exceptional-resistance-duration.json", "weapon": "epee", "status": "active", "sourceIds": ["EPEE-03", "EPEE-TEST-RESISTANCE"], "contentDigest": "sha256:75418115ba9de92e985940e612bce429dcced962b57e17929ad1b78dae5a5237" },
    { "scenarioId": "epee.grounded-material-100-ohm", "path": "golden-scenarios/epee-grounded-material-100-ohm.json", "weapon": "epee", "status": "active", "sourceIds": ["EPEE-04", "EPEE-TEST-RESISTANCE"], "contentDigest": "sha256:2bfa019c00d3e1b412b50f97543b42e40aaac1ab0cc99ade1d1285b410c35848" },
    { "scenarioId": "epee.grounded-rejection", "path": "golden-scenarios/epee-grounded-rejection.json", "weapon": "epee", "status": "active", "sourceIds": ["EPEE-04", "EPEE-TEST-GROUNDED"], "contentDigest": "sha256:50ba1c5d4006296e85883697b1c72795addec48f7859d2a45233a05a41b93264" },
    { "scenarioId": "epee.non-monotonic-time", "path": "golden-scenarios/epee-non-monotonic-time.json", "weapon": "epee", "status": "active", "sourceIds": ["EPEE-TEST-MONOTONIC-TIME"], "contentDigest": "sha256:8cc02fd15c48e59314471c82323f517ba14c97d565ce37b266f5b8801116ede4" },
    { "scenarioId": "epee.resistance-uncertainty-near-lockout", "path": "golden-scenarios/epee-resistance-uncertainty-near-lockout.json", "weapon": "epee", "status": "active", "sourceIds": ["EPEE-02", "EPEE-03", "EPEE-TEST-RESISTANCE"], "contentDigest": "sha256:958682677ae24403a6ca2a09c21a50131a3cf06f5f862a6537a2e96f44dfa736" },
    { "scenarioId": "foil.break-boundaries", "path": "golden-scenarios/foil-break-boundaries.json", "weapon": "foil", "status": "active", "sourceIds": ["FOIL-01", "FOIL-02", "FOIL-TEST-BREAK-DURATION"], "contentDigest": "sha256:8d6bd05c5c9e34591802813e5df2a69424a4fd294228305afd73256a8d8528f2" },
    { "scenarioId": "foil.grounded-contact", "path": "golden-scenarios/foil-grounded-contact.json", "weapon": "foil", "status": "active", "sourceIds": ["FOIL-03", "FOIL-TEST-GROUNDED-CONTAINMENT"], "contentDigest": "sha256:cb409c47b38adc0fcfb19a956e00e7e7305891ba60ee1bd308e59c080eb4b407" },
    { "scenarioId": "foil.host-logical-contexts", "path": "golden-scenarios/foil-host-logical-contexts.json", "weapon": "foil", "status": "active", "sourceIds": ["FOIL-03", "FOIL-04", "FOIL-TEST-HOST-CONTEXT"], "contentDigest": "sha256:77b91bc45486a22bf20315703200c9a0f2018a9185971be0fc954208c420cd13" },
    { "scenarioId": "foil.host-resistance-classifications", "path": "golden-scenarios/foil-host-resistance-classifications.json", "weapon": "foil", "status": "active", "sourceIds": ["FOIL-02", "FOIL-03", "FOIL-TEST-HOST-RESISTANCE"], "contentDigest": "sha256:24fb40d08a994bcd54644fb494760262d5cd087e14b4f460a38d603988023c64" },
    { "scenarioId": "foil.insulation-handoff", "path": "golden-scenarios/foil-insulation-handoff.json", "weapon": "foil", "status": "active", "sourceIds": ["FOIL-04", "FOIL-TEST-INSULATION-HANDOFF"], "contentDigest": "sha256:ee32fa35910cf40c5f820c1ef63a3629e39eefaedde5309440e889c387cfc38f" },
    { "scenarioId": "foil.integrity-and-uncertainty", "path": "golden-scenarios/foil-integrity-and-uncertainty.json", "weapon": "foil", "status": "active", "sourceIds": ["FOIL-03", "FOIL-TEST-FAULT-CONTAINMENT"], "contentDigest": "sha256:4ef08f0a396e346bec1931b678cc2c2e73656493a272d478f154ab25f4d2a0f6" },
    { "scenarioId": "foil.lockout-cutoff", "path": "golden-scenarios/foil-lockout-cutoff.json", "weapon": "foil", "status": "active", "sourceIds": ["FOIL-05", "FOIL-TEST-LOCKOUT-CUTOFF"], "contentDigest": "sha256:3d84129bba34bff625f9950bfc9efc78044a070f12e643fbdaf2f4accb78063b" },
    { "scenarioId": "foil.nominal-break", "path": "golden-scenarios/foil-nominal-break.json", "weapon": "foil", "status": "active", "sourceIds": ["FOIL-02", "FOIL-TEST-BREAK-DURATION"], "contentDigest": "sha256:521b13422aec0dd7416d6551df46af30072d4189b39ce0da067e57324c34d0f4" },
    { "scenarioId": "foil.same-side-and-lockout", "path": "golden-scenarios/foil-same-side-and-lockout.json", "weapon": "foil", "status": "active", "sourceIds": ["FOIL-05", "FOIL-TEST-LOCKOUT-WINDOW"], "contentDigest": "sha256:e07d1ecdab9bfbdc95e64355f5273cfb54c5ed8f197d5136e2abad31e2c88b42" },
    { "scenarioId": "foil.target-context", "path": "golden-scenarios/foil-target-context.json", "weapon": "foil", "status": "active", "sourceIds": ["FOIL-01", "FOIL-TEST-STABLE-CONTEXT", "FOIL-TEST-TARGET-CONTEXT"], "contentDigest": "sha256:ea02eb7ac4f3434def797575426f91971d63b7e5fd8ddf4bea04f5c630ebf5f9" },
    { "scenarioId": "sabre.contact-floor-boundaries", "path": "golden-scenarios/sabre-contact-floor-boundaries.json", "weapon": "sabre", "status": "active", "sourceIds": ["SABRE-01", "SABRE-03", "SABRE-TEST-CONTACT-FLOOR"], "contentDigest": "sha256:b8a37425fca444ade5f679533c62ca4031261ef3e13e266f94d7fb57bf9b0fed" },
    { "scenarioId": "sabre.control-break-diagnostic-boundaries", "path": "golden-scenarios/sabre-control-break-diagnostic-boundaries.json", "weapon": "sabre", "status": "active", "sourceIds": ["SABRE-07", "SABRE-TEST-GOLDEN-CONTROL-BREAK"], "contentDigest": "sha256:79623caba90de96a1907d2a5aa4890655aadf832f1330745df14136289cb77e3" },
    { "scenarioId": "sabre.external-100-ohm-host-boundary", "path": "golden-scenarios/sabre-external-100-ohm-host-boundary.json", "weapon": "sabre", "status": "active", "sourceIds": ["SABRE-03", "SABRE-TEST-EXTERNAL-100-OHM"], "contentDigest": "sha256:6c8748aaf674e1a0938bc76a169a27d5f79f1f9167d309cdb423a5466dada1a8" },
    { "scenarioId": "sabre.external-path-containment", "path": "golden-scenarios/sabre-external-path-containment.json", "weapon": "sabre", "status": "active", "sourceIds": ["SABRE-03", "SABRE-TEST-EXTERNAL-PATH", "SABRE-TEST-OPPOSITE-INDEPENDENCE"], "contentDigest": "sha256:c8344dc737b8311f75eaaf1b277de6574fd4d672b1347af5b975b393a03228dd" },
    { "scenarioId": "sabre.lockout-boundary", "path": "golden-scenarios/sabre-lockout-boundary.json", "weapon": "sabre", "status": "active", "sourceIds": ["SABRE-05", "SABRE-TEST-LOCKOUT"], "contentDigest": "sha256:32a6cf8d76cb06472f61640ad5c2cb31386f143d6ed1724cd2a65329de0d6363" },
    { "scenarioId": "sabre.lockout-cutoff", "path": "golden-scenarios/sabre-lockout-cutoff.json", "weapon": "sabre", "status": "active", "sourceIds": ["SABRE-05", "SABRE-TEST-LOCKOUT-CUTOFF"], "contentDigest": "sha256:7a50bb03a92b34720e8bfda55c86456c2ddc201b85b2b69c297e318496f5b676" },
    { "scenarioId": "sabre.own-equipment-hit-continuity", "path": "golden-scenarios/sabre-own-equipment-hit-continuity.json", "weapon": "sabre", "status": "active", "sourceIds": ["SABRE-01", "SABRE-04", "SABRE-TEST-OWN-EQUIPMENT-CONTINUITY"], "contentDigest": "sha256:e0eb8ce134200dfb82cc0784f06290e262bfd96288a6212fb07a48bde6f33d2b" },
    { "scenarioId": "sabre.whipover-boundaries-and-recovery", "path": "golden-scenarios/sabre-whipover-boundaries-and-recovery.json", "weapon": "sabre", "status": "active", "sourceIds": ["SABRE-03", "SABRE-06", "SABRE-TEST-WHIPOVER-ENDPOINTS"], "contentDigest": "sha256:46aee27229ffb976e69b3cb51e5dedd5ad39418e55da35d2f57940782334f65d" },
    { "scenarioId": "sabre.white-abnormal-change-latch", "path": "golden-scenarios/sabre-white-abnormal-change-latch.json", "weapon": "sabre", "status": "active", "sourceIds": ["SABRE-02", "SABRE-TEST-GOLDEN-ABNORMAL-CHANGE"], "contentDigest": "sha256:7f3f5d1932929902276bde8f54c52259cb22bd4b6d4e71ae6dc768fc2bd2022c" },
    { "scenarioId": "sabre.yellow-onset-clear", "path": "golden-scenarios/sabre-yellow-onset-clear.json", "weapon": "sabre", "status": "active", "sourceIds": ["SABRE-02", "SABRE-TEST-GOLDEN-YELLOW"], "contentDigest": "sha256:ce56349b4efda272219abd98144c0b0992daff6ffab129e6ee61228a46f6dc82" }
  ],
  "coverage": [
    { "traceabilityId": "EPEE-01", "description": "Register a contact that completes the epee circuit while rejecting grounded material.", "status": "covered", "scenarioIds": ["epee.contact-boundaries", "epee.grounded-rejection"] },
    { "traceabilityId": "EPEE-02", "description": "Apply the selected epee double-hit window and retain an opposing hit at its boundary.", "status": "covered", "scenarioIds": ["epee.double-lockout-boundary"] },
    { "traceabilityId": "EPEE-03", "description": "Enforce the epee contact-duration and exceptional-resistance behavior, including the two-millisecond minimum.", "status": "covered", "scenarioIds": ["epee.contact-boundaries", "epee.exceptional-resistance-duration", "epee.resistance-uncertainty-near-lockout"] },
    { "traceabilityId": "EPEE-04", "description": "Reject epee hits on earthed material while preserving an opposing valid contact.", "status": "covered", "scenarioIds": ["epee.grounded-material-100-ohm", "epee.grounded-rejection"] },